CREATE EXTENSION xnode;
-- This is rather a generic set of tests.
SET search_path TO xml;
CREATE TABLE STATES ( 
	id int not null,
	data doc not null
);
CREATE TABLE PATHS (
	id int,
	name varchar(32),
	path xml.path not null
);
CREATE TABLE DOCS_OTHER (
	id int,
	data doc not null
);
-- Random geografic data
-- Czech and German languages are both good to test handling of multi-byte characters
INSERT INTO STATES VALUES(1,  '<?xml version="1.0" encoding="UTF-8"?>
	<state name="Česká republika" area="78866" population="10674947" tld="cz">
	<!-- Resource: http://en.wikipedia.org/wiki/Czech_Republic -->
	<city name="Praha" capital="true"/>
	<city name="Plzeň"><part name="Doubravka"/></city>
	<city name="Čerčany"/>
	<region name="Šumava"><destination name="Lipno"><![CDATA[http://en.wikipedia.org/wiki/Lipno_Dam]]></destination></region>
	<languages><language>Cestina</language></languages>
</state>');
INSERT INTO STATES VALUES(2,  '<?xml version="1.0" encoding="UTF-8"?><state name="Bundesrepublik Deutschland" area="357021" population="81757600" tld="de">
	<!-- Resource: http://en.wikipedia.org/wiki/Deutschland -->
	<city name="Berlin" capital="true"/>
	<region name="Baden-Württemberg"><city name="Stuttgart" capital="true"/></region>
	<region name="Bayern"><city name="Munchen" capital="true"/></region>
	<region name="Thüringen"><city name="Erfurt" capital="true"/></region>
	<languages><language official="true">Deutsch</language></languages>
</state>');
INSERT INTO STATES VALUES(3,  '<?xml version="1.0" encoding="UTF-8" ?><state name="Österreich" area="83872" population="8356707" tld="at">
	<!-- Resource: http://en.wikipedia.org/wiki/Oesterreich -->
	<city name="Wien" capital="true"/>
	<region name="Tirol"><city name="Innsbruck" capital="true"/></region>
	<region name="Steiermark"><city name="Graz" capital="true"/></region>
	<region name="Vorarlberg"><city name="Bregenz" capital="true"/></region>
	<languages><language official="true">Deutsch</language></languages>
</state>');
update states set data=xml.add(data, '/state/languages', '<region name="Brandenburg"><city name="Potsdam" capital="true"/></region>', 'b') where id=2;
update states set data=add(data, '/state/languages', '<region name="Saarland" area="2569" population="1056000"/>', 'b') where id=2;
update states set data=add(data, '/state/region[@name="Saarland"]', '<city name="Saarbrücken" capital="true"/>', 'i') where id=2;
update states set data=add(data, '/state/region[@name="Saarland"]', '<city name="Ottweiler"/>', 'i') where id=2;
update states set data=add(data, '/state/region[@name="Saarland"]/city[@name="Saarbrücken"]', '<city name="Neunkirchen"/>', 'a') where id=2;
-- Simply dump the XML documents
select *
from states
order by id;
 id |                                                                                                                                                       data                                                                                                                                                        
----+-------------------------------------------------------------------------------------------------------------------------------------------------------------------------------------------------------------------------------------------------------------------------------------------------------------------
  1 | <?xml version="1.0" encoding="UTF8"?><state name="Česká republika" area="78866" population="10674947" tld="cz">                                                                                                                                                                                                  +
    |         <!-- Resource: http://en.wikipedia.org/wiki/Czech_Republic -->                                                                                                                                                                                                                                           +
    |         <city name="Praha" capital="true"/>                                                                                                                                                                                                                                                                      +
    |         <city name="Plzeň"><part name="Doubravka"/></city>                                                                                                                                                                                                                                                       +
    |         <city name="Čerčany"/>                                                                                                                                                                                                                                                                                   +
    |         <region name="Šumava"><destination name="Lipno">http://en.wikipedia.org/wiki/Lipno_Dam</destination></region>                                                                                                                                                                                            +
    |         <languages><language>Cestina</language></languages>                                                                                                                                                                                                                                                      +
    | </state>
  2 | <?xml version="1.0" encoding="UTF8"?><state name="Bundesrepublik Deutschland" area="357021" population="81757600" tld="de">                                                                                                                                                                                      +
    |         <!-- Resource: http://en.wikipedia.org/wiki/Deutschland -->                                                                                                                                                                                                                                              +
    |         <city name="Berlin" capital="true"/>                                                                                                                                                                                                                                                                     +
    |         <region name="Baden-Württemberg"><city name="Stuttgart" capital="true"/></region>                                                                                                                                                                                                                        +
    |         <region name="Bayern"><city name="Munchen" capital="true"/></region>                                                                                                                                                                                                                                     +
    |         <region name="Thüringen"><city name="Erfurt" capital="true"/></region>                                                                                                                                                                                                                                   +
    |         <region name="Brandenburg"><city name="Potsdam" capital="true"/></region><region name="Saarland" area="2569" population="1056000"><city name="Saarbrücken" capital="true"/><city name="Neunkirchen"/><city name="Ottweiler"/></region><languages><language official="true">Deutsch</language></languages>+
    | </state>
  3 | <?xml version="1.0" encoding="UTF8"?><state name="Österreich" area="83872" population="8356707" tld="at">                                                                                                                                                                                                        +
    |         <!-- Resource: http://en.wikipedia.org/wiki/Oesterreich -->                                                                                                                                                                                                                                              +
    |         <city name="Wien" capital="true"/>                                                                                                                                                                                                                                                                       +
    |         <region name="Tirol"><city name="Innsbruck" capital="true"/></region>                                                                                                                                                                                                                                    +
    |         <region name="Steiermark"><city name="Graz" capital="true"/></region>                                                                                                                                                                                                                                    +
    |         <region name="Vorarlberg"><city name="Bregenz" capital="true"/></region>                                                                                                                                                                                                                                 +
    |         <languages><language official="true">Deutsch</language></languages>                                                                                                                                                                                                                                      +
    | </state>
(3 rows)

-- Query some XML paths 
select path('/state/@name', data) as state, path('/state/@tld', data) as domain,
path('/state/languages/language/text()', data) as language
from states
order by id;
           state            | domain | language 
----------------------------+--------+----------
 Česká republika            | cz     | Cestina
 Bundesrepublik Deutschland | de     | Deutsch
 Österreich                 | at     | Deutsch
(3 rows)

select id, path('count(//city)', data)
from states
order by id;
 id | path 
----+------
  1 | 3
  2 | 8
  3 | 4
(3 rows)

with paths(name, area, population)
as (select '/state/@name'::xml.path, '/state/@area'::xml.path, '/state/@population'::xml.path)
select  id, path(p.name, data) as name, path(p.area, data) as area,
path(p.population, data) as population
from states s, paths p
order by s.id;
 id |            name            |  area  | population 
----+----------------------------+--------+------------
  1 | Česká republika            | 78866  | 10674947
  2 | Bundesrepublik Deutschland | 357021 | 81757600
  3 | Österreich                 | 83872  | 8356707
(3 rows)

-- The XML path expressions can also be parsed (preprocessed) and stored into a table for later use...
insert into paths (name, path) values ('names', '/state/@name'), ('capitals', '/state/city[@capital="true"]/@name'), ('regions', '/state/region'), ('region_capitals', '/region/city[@capital="true"]/@name');
-- ... and used
select path(pn.path, s.data) as name, path(pc.path, s.data) as capital
from states s
join paths pn on (pn.name='names') 
join paths pc on (pc.name='capitals')
order by s.id;
            name            | capital 
----------------------------+---------
 Česká republika            | Praha
 Bundesrepublik Deutschland | Berlin
 Österreich                 | Wien
(3 rows)

select s.id, path(p.path, data)
from states s
join paths p on (p.name='regions')
order by s.id;
 id |                                                                                                                                                                                                                               path                                                                                                                                                                                                                                
----+-------------------------------------------------------------------------------------------------------------------------------------------------------------------------------------------------------------------------------------------------------------------------------------------------------------------------------------------------------------------------------------------------------------------------------------------------------------------
  1 | <region name="Šumava"><destination name="Lipno">http://en.wikipedia.org/wiki/Lipno_Dam</destination></region>
  2 | <region name="Baden-Württemberg"><city name="Stuttgart" capital="true"/></region><region name="Bayern"><city name="Munchen" capital="true"/></region><region name="Thüringen"><city name="Erfurt" capital="true"/></region><region name="Brandenburg"><city name="Potsdam" capital="true"/></region><region name="Saarland" area="2569" population="1056000"><city name="Saarbrücken" capital="true"/><city name="Neunkirchen"/><city name="Ottweiler"/></region>
  3 | <region name="Tirol"><city name="Innsbruck" capital="true"/></region><region name="Steiermark"><city name="Graz" capital="true"/></region><region name="Vorarlberg"><city name="Bregenz" capital="true"/></region>
(3 rows)

-- Convert data to table-like form
select id, path('/state', '{"region/city", "@area", "@population", "@tld"}', data) as state_info
from states
order by id;
 id |                                                                                                                                           state_info                                                                                                                                            
----+-------------------------------------------------------------------------------------------------------------------------------------------------------------------------------------------------------------------------------------------------------------------------------------------------
  1 | {NULL,78866,10674947,cz}
  2 | {"<city name=\"Stuttgart\" capital=\"true\"/><city name=\"Munchen\" capital=\"true\"/><city name=\"Erfurt\" capital=\"true\"/><city name=\"Potsdam\" capital=\"true\"/><city name=\"Saarbrücken\" capital=\"true\"/><city name=\"Neunkirchen\"/><city name=\"Ottweiler\"/>",357021,81757600,de}
  3 | {"<city name=\"Innsbruck\" capital=\"true\"/><city name=\"Graz\" capital=\"true\"/><city name=\"Bregenz\" capital=\"true\"/>",83872,8356707,at}
(3 rows)

-- Replace node
update states set data=add(data, '/state/region[@name="Šumava"]/destination', '<destination name="Boubín"/>', 'r') where id=1;
-- Add document fragment
-- before:
update states set data=add(data, '/state/languages', '<city name="České Budějovice" population="95071"/><city name="Kroměříž"/>', 'b') where id=1;
-- after:
 update states set data=add(data, '/state/city[@name="Praha"]', '<city name="Uherské Hradiště"/><city name="Františkovy Lázně"/>', 'a') where id=1;
-- into:
update states set data=add(data, '/state/city[@name="Praha"]', '<city name="Žižkov"/><city name="Břevnov"/>', 'i') where id=1;
-- into empty element (special case):
update states set data=add(data, '/state', '<people/>', 'i') where id=1;
update states set data=add(data, '/state/people', '<person first_name="Antonín" last_name="Dvořák"/><person first_name="Václav" last_name="Havel"/>', 'i') where id=1;
-- replace:
update states set data=add(data, '/state/languages/language', '<language official="true">Čeština</language><language>Hantec</language>', 'r') where id=1;
select data
from states
where id=1
order by id;
                                                                                      data                                                                                       
---------------------------------------------------------------------------------------------------------------------------------------------------------------------------------
 <?xml version="1.0" encoding="UTF8"?><state name="Česká republika" area="78866" population="10674947" tld="cz">                                                                +
         <!-- Resource: http://en.wikipedia.org/wiki/Czech_Republic -->                                                                                                         +
         <city name="Praha" capital="true"><city name="Žižkov"/><city name="Břevnov"/></city><city name="Uherské Hradiště"/><city name="Františkovy Lázně"/>                    +
         <city name="Plzeň"><part name="Doubravka"/></city>                                                                                                                     +
         <city name="Čerčany"/>                                                                                                                                                 +
         <region name="Šumava"><destination name="Boubín"/></region>                                                                                                            +
         <city name="České Budějovice" population="95071"/><city name="Kroměříž"/><languages><language official="true">Čeština</language><language>Hantec</language></languages>+
 <people><person first_name="Antonín" last_name="Dvořák"/><person first_name="Václav" last_name="Havel"/></people></state>
(1 row)

-- remove node:
update states set data=remove(data, '/state/city[@name="Kroměříž"]') where id=1;
-- ... and test if node will be correctly displayed as an empty element when the only child is removed:
update states set data=remove(data, '/state/city[@name="Plzeň"]/part[@name="Doubravka"]') where id=1;
select data
from states
where id=1
order by id;
                                                                            data                                                                             
-------------------------------------------------------------------------------------------------------------------------------------------------------------
 <?xml version="1.0" encoding="UTF8"?><state name="Česká republika" area="78866" population="10674947" tld="cz">                                            +
         <!-- Resource: http://en.wikipedia.org/wiki/Czech_Republic -->                                                                                     +
         <city name="Praha" capital="true"><city name="Žižkov"/><city name="Břevnov"/></city><city name="Uherské Hradiště"/><city name="Františkovy Lázně"/>+
         <city name="Plzeň"/>                                                                                                                               +
         <city name="Čerčany"/>                                                                                                                             +
         <region name="Šumava"><destination name="Boubín"/></region>                                                                                        +
         <city name="České Budějovice" population="95071"/><languages><language official="true">Čeština</language><language>Hantec</language></languages>   +
 <people><person first_name="Antonín" last_name="Dvořák"/><person first_name="Václav" last_name="Havel"/></people></state>
(1 row)

-- remove() - repeated occurrence of the target path:
update states set data=remove(data, '/state/text()');
select data
from states
order by id;
                                                                                                                                                                                                                                                                                                                                                                                  data                                                                                                                                                                                                                                                                                                                                                                                  
------------------------------------------------------------------------------------------------------------------------------------------------------------------------------------------------------------------------------------------------------------------------------------------------------------------------------------------------------------------------------------------------------------------------------------------------------------------------------------------------------------------------------------------------------------------------------------------------------------------------------------------------------------------------------------------------------------------------------------------------------------------------
 <?xml version="1.0" encoding="UTF8"?><state name="Česká republika" area="78866" population="10674947" tld="cz"><!-- Resource: http://en.wikipedia.org/wiki/Czech_Republic --><city name="Praha" capital="true"><city name="Žižkov"/><city name="Břevnov"/></city><city name="Uherské Hradiště"/><city name="Františkovy Lázně"/><city name="Plzeň"/><city name="Čerčany"/><region name="Šumava"><destination name="Boubín"/></region><city name="České Budějovice" population="95071"/><languages><language official="true">Čeština</language><language>Hantec</language></languages><people><person first_name="Antonín" last_name="Dvořák"/><person first_name="Václav" last_name="Havel"/></people></state>
 <?xml version="1.0" encoding="UTF8"?><state name="Bundesrepublik Deutschland" area="357021" population="81757600" tld="de"><!-- Resource: http://en.wikipedia.org/wiki/Deutschland --><city name="Berlin" capital="true"/><region name="Baden-Württemberg"><city name="Stuttgart" capital="true"/></region><region name="Bayern"><city name="Munchen" capital="true"/></region><region name="Thüringen"><city name="Erfurt" capital="true"/></region><region name="Brandenburg"><city name="Potsdam" capital="true"/></region><region name="Saarland" area="2569" population="1056000"><city name="Saarbrücken" capital="true"/><city name="Neunkirchen"/><city name="Ottweiler"/></region><languages><language official="true">Deutsch</language></languages></state>
 <?xml version="1.0" encoding="UTF8"?><state name="Österreich" area="83872" population="8356707" tld="at"><!-- Resource: http://en.wikipedia.org/wiki/Oesterreich --><city name="Wien" capital="true"/><region name="Tirol"><city name="Innsbruck" capital="true"/></region><region name="Steiermark"><city name="Graz" capital="true"/></region><region name="Vorarlberg"><city name="Bregenz" capital="true"/></region><languages><language official="true">Deutsch</language></languages></state>
(3 rows)

-- Additional tests
-- add() - repeated occurrence of the target path:
select add('<a><b/><b/></a>', '/a/b', '<x><y/></x>', 'b');
                  add                  
---------------------------------------
 <a><x><y/></x><b/><x><y/></x><b/></a>
(1 row)

select add('<a><b/><b/></a>', '/a/b', '<x><y/></x>', 'a');
                  add                  
---------------------------------------
 <a><b/><x><y/></x><b/><x><y/></x></a>
(1 row)

select add('<a><b/><b/></a>', '/a/b', '<x><y/></x>', 'r');
              add              
-------------------------------
 <a><x><y/></x><x><y/></x></a>
(1 row)

-- insert into both empty and non-empty element
select add('<a><b/><b/></a>', '/a/b', '<x><y/></x>', 'i');
                     add                     
---------------------------------------------
 <a><b><x><y/></x></b><b><x><y/></x></b></a>
(1 row)

select add('<a><b><d/></b><b><d/></b></a>', '/a/b', '<x><y/></x>', 'i');
                         add                         
-----------------------------------------------------
 <a><b><d/><x><y/></x></b><b><d/><x><y/></x></b></a>
(1 row)

select add('<a><b id="1"/><b id="2"/></a>', '/a/b', '<x><y/></x>', 'i');
                            add                            
-----------------------------------------------------------
 <a><b id="1"><x><y/></x></b><b id="2"><x><y/></x></b></a>
(1 row)

-- and the same for document fragment:
select add('<a><b/><b/></a>', '/a/b', '<x><y/></x><!--no comment-->', 'b');
                                   add                                   
-------------------------------------------------------------------------
 <a><x><y/></x><!--no comment--><b/><x><y/></x><!--no comment--><b/></a>
(1 row)

select add('<a><b/><b/></a>', '/a/b', '<x><y/></x><!--no comment-->', 'a');
                                   add                                   
-------------------------------------------------------------------------
 <a><b/><x><y/></x><!--no comment--><b/><x><y/></x><!--no comment--></a>
(1 row)

select add('<a><b/><b/></a>', '/a/b', '<x><y/></x><!--no comment-->', 'r');
                               add                               
-----------------------------------------------------------------
 <a><x><y/></x><!--no comment--><x><y/></x><!--no comment--></a>
(1 row)

select add('<a><b/><b/></a>', '/a/b', '<x><y/></x><!--no comment-->', 'i');
                                      add                                      
-------------------------------------------------------------------------------
 <a><b><x><y/></x><!--no comment--></b><b><x><y/></x><!--no comment--></b></a>
(1 row)

select add('<a><b><d/></b><b><d/></b></a>', '/a/b', '<x><y/></x><!--no comment-->', 'i');
                                          add                                          
---------------------------------------------------------------------------------------
 <a><b><d/><x><y/></x><!--no comment--></b><b><d/><x><y/></x><!--no comment--></b></a>
(1 row)

select add('<a><b id="1"/><b id="2"/></a>', '/a/b', '<x><y/></x><!--no comment-->', 'i');
                                             add                                             
---------------------------------------------------------------------------------------------
 <a><b id="1"><x><y/></x><!--no comment--></b><b id="2"><x><y/></x><!--no comment--></b></a>
(1 row)

-- remove() - repeated occurrence of the target path:
-- remove attribute
select remove('<a><b id="1" d="1"/><b id="2" d="2"/></a>', '/a/b/@id');
           remove            
-----------------------------
 <a><b d="1"/><b d="2"/></a>
(1 row)

-- remove the last attribute
select remove('<a><b id="1"/><b id="2"/></a>', '/a/b/@id');
     remove      
-----------------
 <a><b/><b/></a>
(1 row)

-- remove the last nested node(s)
select remove('<a><b/><b/></a>', '/a/b');
 remove 
--------
 <a/>
(1 row)

-- DOM
select xml.children('<root><a><!--cmnt--></a><b><?abc def?></b><c/></root>');
                    children                    
------------------------------------------------
 {<a><!--cmnt--></a>,"<b><?abc def?></b>",<c/>}
(1 row)

select xml.element('root', '{{"i", "x"}, {"j", 1}, {"k", ""}}', '<x/><y/>');
                element                 
----------------------------------------
 <root i="x" j="1" k=""><x/><y/></root>
(1 row)

select xml.element('root', '{{"i", "x"}, {"j", 1}}', '<x k="u"><y l="v"/></x>');
                     element                      
--------------------------------------------------
 <root i="x" j="1"><x k="u"><y l="v"/></x></root>
(1 row)

select xml.element('root', NULL, '<x k="u"><y l="v"/></x>');
               element                
--------------------------------------
 <root><x k="u"><y l="v"/></x></root>
(1 row)

select xml.element('root', '{{"i", "x"}, {"j", 1}}', NULL);
       element       
---------------------
 <root i="x" j="1"/>
(1 row)

-- xml.fragment()
WITH tmp(n) as (VALUES ('<a i="1"/>'), ('<!--c-->'), ('<c><d j="2"/></c>'))
SELECT xml.fragment(n::xml.node)
FROM tmp;
              fragment               
-------------------------------------
 <a i="1"/><!--c--><c><d j="2"/></c>
(1 row)

